category,title,creator,publication_year,description
movie,Winter Cake,Dr. Orlando Toy,1985,Doloribus aspernatur tenetur et.
movie,Pumpkin-spice Enlightenment,Gaylord Morissette IV,1948,Recusandae est cumque consequatur.
movie,Reg's Forrester,Milford Prohaska,1955,Quaerat quis unde ab.
book,Cascara Light,Janita Barton II,1943,Unde velit sit sed.
album,Chocolate Pie,Jae Bergnaum,1943,Voluptatem quasi perspiciatis earum.
album,Blue Cowboy,Dr. Jessie Ritchie,1989,Quam et adipisci unde.
book,Brooklyn Blend,Ms. Erick Hammes,1978,Sunt ab architecto quidem.
album,Wake-up Cowboy,Latoria Gottlieb,1959,At ut dolorem rem.
book,Cascara Nuts,Vilma Bahringer DVM,1993,Laudantium natus ut voluptatibus.
book,Winter Choice,Alverta Huels Jr.,1959,Harum possimus adipisci qui.
movie,Bluebery Choice,Eugene Wolff,1965,Distinctio sint sequi voluptatem.
album,Reg's Breaker,Agatha Sporer,1989,Quisquam numquam voluptatibus deleniti.
movie,Dark ,Mrs. Santa Schoen,1962,Nesciunt omnis nulla et.
movie,Blue Been,Leonardo Gleason,1990,Dolores quas harum aut.
book,Blue Extract,Cecila Daniel,2009,Exercitationem ea officia sed.
album,The Captain's Cowboy,Lucienne Schuppe,2005,Culpa saepe fugiat fugit.
movie,Thanksgiving Cake,Maria Haley,1976,Sed dolorem nemo eos.
book,Summer Been,Mason Sanford,1987,Assumenda alias et eveniet.
book,Good-morning Treat,Jame Frami PhD,2011,Iste blanditiis ab consequatur.
book,Street Select,Enedina Macejkovic,1921,Praesentium voluptatem pariatur maiores.
movie,Spilt Level,Miss Kenton Swaniawski,1987,Aperiam dicta minima quia.
book,Blacktop Cup,Jerrie Leffler,1933,Et dignissimos ut qui.
movie,Bluebery ,Anjanette Klocko,1952,Officiis aut voluptatum quidem.
movie,Morning Look,Syreeta Baumbach DVM,1927,Omnis rerum aliquam sed.
movie,The Mug,Maximo Glover,1981,Magnam et ea debitis.
